{
  "schemaVersion": 1,
  "providerId": "demo-plan",
  "displayName": "Demo Plan",
  "status": "ok",
  "observedAt": "2026-10-02T12:00:00Z",
  "windows": [
    {
      "id": "weekly",
      "label": "7d",
      "support": "supported",
      "remainingPercent": 68,
      "state": "fresh",
      "reset": {
        "kind": "rolling",
        "at": "2026-10-06T12:00:00Z"
      }
    },
    {
      "id": "five-hour",
      "label": "5h",
      "support": "unsupported"
    }
  ]
}
